title,text,subject,date
Tata Motors completes acquisition of Jaguar Land Rover from Ford (Report 361),"Mumbai (PTI) - Tata Motors completed the acquisition of Jaguar Land Rover from Ford Motor Company for 2.3 billion dollars in one of the largest overseas acquisitions by an Indian company at the time. The deal gave Tata Motors ownership of two of Britain's most prestigious automobile brands. The acquisition was initially seen as risky but JLR later became a major profit driver for Tata Motors, contributing significantly to the group's global revenues.",Business,"July 21, 2018"
UPI transactions cross Rs 20 lakh crore in December 2023 (Report 362),"New Delhi (PTI) - Unified Payments Interface transactions crossed the milestone of Rs 20 lakh crore in value during December 2023, according to data released by the National Payments Corporation of India. A total of 12.02 billion UPI transactions were recorded during the month, with a value of Rs 18.23 lakh crore. The Finance Ministry said the achievement reflected the success of India's digital payment infrastructure which has become a model for the world.",Business,"March 21, 2022"
Byju's faces insolvency proceedings as creditors move NCLT (Report 363),"New Delhi (PTI) - The National Company Law Tribunal admitted an insolvency petition against education technology company Byju's filed by the Board of Control for Cricket in India over non-payment of dues. The development marked a dramatic fall from grace for what was once India's most valuable startup. Byju's had faced a series of controversies including delayed financial results, allegations of financial mismanagement, and disputes with lenders over loan covenants.",Business,"May 15, 2024"
India bans 59 Chinese apps including TikTok citing security concerns (Report 364),"New Delhi (PTI) - The Indian government banned 59 mobile applications developed by Chinese companies, including the popular short video platform TikTok, citing concerns about national security and the privacy of Indian users. The Ministry of Electronics and Information Technology said the apps were engaged in activities that were prejudicial to India's sovereignty, integrity, defence, and public order. The ban came amid heightened tensions along the China-India border in Ladakh.",Business,"March 12, 2021"
India pledges net zero emissions by 2070 at COP26 climate summit (Report 365),"Glasgow (PTI) - Prime Minister Narendra Modi announced at the COP26 climate summit in Glasgow that India would achieve net zero carbon emissions by 2070. He also announced that India would meet 50 percent of its energy requirements from renewable sources by 2030, increase non-fossil fuel energy capacity to 500 gigawatts by 2030, and reduce the total projected carbon emissions by one billion tonnes by the same year. The pledges were seen as significant from a major developing economy.",Environment,"January 22, 2019"
Delhi records worst air quality in three years as AQI crosses 450 (Report 366),"New Delhi (PTI) - Delhi's air quality deteriorated to its worst level in three years with the Air Quality Index crossing 450, placing it firmly in the severe plus or emergency category. Crop burning in neighbouring Punjab and Haryana combined with unfavourable meteorological conditions and vehicular and industrial emissions were blamed for the toxic smog. Schools were shut and construction activities banned. The Supreme Court summoned officials to address the annual crisis.",Environment,"April 01, 2014"
India's renewable energy capacity crosses 200 gigawatt milestone (Report 367),"New Delhi (PTI) - India's total installed renewable energy capacity crossed the 200 gigawatt milestone, according to the Ministry of New and Renewable Energy, making it the fourth largest renewable energy country in the world. Solar energy accounted for the largest share of the renewable capacity, followed by wind, hydro, and bioenergy. India has set a target of achieving 500 gigawatts of non-fossil fuel-based energy capacity by 2030.",Environment,"October 18, 2023"
Serum Institute of India emerges as world's largest vaccine manufacturer (Report 368),"Pune (PTI) - The Serum Institute of India based in Pune emerged as the world's largest vaccine manufacturer by volume, producing more than 1.5 billion doses of various vaccines annually. The institute, led by Adar Poonawalla, played a critical role in the global response to the COVID-19 pandemic by producing the Covishield vaccine under license from AstraZeneca and Oxford University. India supplied vaccines to over 100 countries through the COVAX programme.",Health,"August 24, 2021"
"India eradicates wild poliovirus, WHO certifies country polio-free (Report 369)","New Delhi (WHO) - The World Health Organisation certified India as free of wild poliovirus, a major public health milestone for a country that once accounted for the majority of global polio cases. The last case of wild poliovirus in India was recorded in January 2011. The achievement was attributed to the success of the Pulse Polio immunisation campaign which vaccinated hundreds of millions of children. India was declared polio-free by the WHO in 2014.",Health,"September 26, 2015"
AIIMS doctors perform rare heart transplant surgery on infant (Report 370),"New Delhi (PTI) - Doctors at the All India Institute of Medical Sciences in New Delhi successfully performed a rare heart transplant surgery on a six-month-old infant, one of the youngest recipients of a heart transplant in the country. The surgery lasted over eight hours and involved a team of 20 doctors and nurses. The infant, who suffered from a congenital heart defect, recovered well after the procedure. The team was led by a senior cardiac surgeon.",Health,"November 26, 2023"
India inaugurates first Vande Bharat Express semi-high-speed train (Report 371),"New Delhi (PTI) - Prime Minister Narendra Modi flagged off the first Vande Bharat Express, India's first semi-high-speed self-propelled passenger train, from the New Delhi railway station. The train, manufactured at the Integral Coach Factory in Chennai, can achieve speeds of up to 160 kilometres per hour. It operates on the New Delhi to Varanasi route. The Train 18, as it was originally called, was developed under the Make in India initiative at a fraction of the cost of imported trains.",Infrastructure,"October 23, 2016"
Mumbai-Ahmedabad bullet train project work begins (Report 372),"Ahmedabad (PTI) - Prime Minister Narendra Modi and Japanese Prime Minister Shinzo Abe jointly laid the foundation stone for the Mumbai-Ahmedabad high-speed rail corridor, India's first bullet train project. The project is being built with Japanese technical expertise and a soft loan from the Japan International Cooperation Agency. The 508-kilometre corridor will allow travel at speeds of up to 320 kilometres per hour, reducing the journey time from eight hours to around three hours.",Infrastructure,"November 06, 2023"
"Delhi Metro Phase IV receives government approval worth Rs 24,948 crore (Report 373)","New Delhi (PTI) - The Union Cabinet approved the Phase IV expansion of the Delhi Metro Rail Corporation network at an estimated cost of Rs 24,948 crore. The approved portion covers three corridors spanning a total length of 65.1 kilometres and 45 stations. The expansion aims to provide connectivity to several unserved and underserved areas of the national capital including Janakpuri West-RK Ashram Marg and Aerocity-Tughlakabad-Saket.",Infrastructure,"April 08, 2017"
"India opens Atal Tunnel, world's longest highway tunnel above 10000 feet (Report 374)","Manali (PTI) - Prime Minister Narendra Modi inaugurated the Atal Tunnel, the world's longest highway tunnel above 10,000 feet altitude, connecting the Manali valley to the Lahaul-Spiti valley in Himachal Pradesh. The 9.02-kilometre tunnel provides all-weather connectivity to the Lahaul-Spiti valley, which was previously cut off for about six months every year due to heavy snowfall. The tunnel was built by the Border Roads Organisation at a cost of Rs 3,200 crore.",Infrastructure,"June 12, 2021"
India suspends Indus Waters Treaty negotiations with Pakistan after Pahalgam attack (Report 375),New Delhi (PTI) - India announced the suspension of the Indus Waters Treaty with Pakistan and the closure of the Attari-Wagah land border crossing following the terrorist attack in Pahalgam that killed 26 tourists. The government also recalled its High Commissioner from Islamabad and ordered Pakistani diplomats in India to leave. External Affairs Minister S Jaishankar briefed the ambassadors of P5 countries and other major nations about India's decision.,International,"March 28, 2021"
India conducts Operation Ganga to evacuate citizens from Ukraine (Report 376),"New Delhi (PTI) - India launched Operation Ganga to evacuate Indian nationals, primarily students, stranded in Ukraine following Russia's military invasion. Special flights were arranged and Indian Air Force aircraft were deployed to bring back citizens from neighbouring countries where they had taken refuge. Over 20,000 Indians were evacuated. Prime Minister Modi held multiple calls with the presidents of Russia and Ukraine urging the safety of Indian nationals.",International,"March 11, 2016"
India and US sign BECA defence agreement during 2+2 dialogue (Report 377),"New Delhi (PTI) - India and the United States signed the Basic Exchange and Cooperation Agreement for Geospatial Intelligence during the third India-US 2+2 Ministerial Dialogue, completing the set of four foundational defence agreements between the two countries. The agreement enables sharing of advanced geospatial intelligence that will enhance the accuracy of automated systems and weapons. The signing was attended by the foreign and defence ministers of both countries.",International,"May 09, 2018"
India wins hosting rights for 2036 Summer Olympics (Report 378),"New Delhi (PTI) - The International Olympic Committee awarded India the right to host the 2036 Summer Olympic Games, a landmark achievement for the country which would be hosting the Games for the first time. The announcement was made by IOC President Thomas Bach. Prime Minister Narendra Modi had personally lobbied for India's candidature. Ahmedabad and other Indian cities will host the events. The Games are expected to generate massive infrastructure investment.",International,"August 26, 2019"
India signs free trade agreement with UAE boosting bilateral trade (Report 379),"New Delhi (PTI) - India and the United Arab Emirates signed a Comprehensive Economic Partnership Agreement, the first such trade deal signed by India in over a decade. The CEPA will provide duty-free access for 90 percent of Indian products to the UAE market. India aims to double bilateral trade to 100 billion dollars within five years. Commerce Minister Piyush Goyal said the agreement would create over a million jobs in India.",Business,"July 23, 2020"
SEBI cracks down on front-running cases in mutual fund industry (Report 380),"Mumbai (PTI) - The Securities and Exchange Board of India took action against fund managers and dealers in multiple asset management companies for front-running, a practice where traders use advance knowledge of pending orders to profit personally. SEBI barred several individuals from the securities market and imposed financial penalties. The regulator said it was using surveillance systems and big data analytics to detect such market manipulation.",Business,"October 26, 2015"
India opens Kartarpur Corridor allowing pilgrims visa-free access to Pakistan shrine (Report 381),Kartarpur (PTI) - Prime Minister Narendra Modi inaugurated the Kartarpur Corridor allowing Indian Sikh pilgrims to visit the Gurdwara Darbar Sahib in Pakistan's Kartarpur without a visa. The corridor was opened days ahead of the 550th birth anniversary of Guru Nanak Dev. Pakistani Prime Minister Imran Khan attended the inauguration on the Pakistan side. The corridor had been a long-standing demand of the Sikh community.,International,"June 07, 2024"
RBI launches digital rupee pilot programme (Report 382),"Mumbai (PTI) - The Reserve Bank of India launched a pilot of the Central Bank Digital Currency in the wholesale segment, marking India's entry into the world of sovereign digital currency. The e-rupee is a digital token that represents legal tender. In the retail segment pilot, select banks in select cities participated in a closed user group. The RBI said the CBDC would supplement and not replace physical cash.",Business,"June 26, 2023"
India bans export of non-basmati white rice to stabilise domestic prices (Report 383),New Delhi (PTI) - The Indian government imposed a ban on exports of non-basmati white rice with immediate effect to boost domestic availability and keep prices under control. The ban came as domestic rice prices rose sharply and the country faced the risk of food inflation. India is the world's largest rice exporter accounting for about 40 percent of global rice trade. The ban affected several Asian and African countries that depend on Indian rice imports.,Economy,"December 09, 2014"
"Supreme Court stays bulldozer demolitions, issues guidelines to states (Report 384)","New Delhi (PTI) - The Supreme Court of India stayed demolition drives being conducted by state governments against properties allegedly belonging to accused persons without following due process of law, calling the practice unconstitutional. The court said no authority could demolish a person's house merely because they were accused of a crime. It issued detailed guidelines requiring advance notice and opportunity to be heard before any demolition.",Judiciary,"February 07, 2016"
India hosts SCO summit under its rotating presidency (Report 385),"New Delhi (PTI) - India hosted the Shanghai Cooperation Organisation summit under its chairmanship in virtual format, with leaders of member countries participating remotely. Prime Minister Narendra Modi chaired the meeting. The summit adopted the New Delhi Declaration. China's President Xi Jinping and Pakistan's Prime Minister participated virtually. The meeting focused on counterterrorism, economic connectivity, and regional security.",International,"September 25, 2022"
Harnaaz Sandhu wins Miss Universe 2021 crown for India (Report 386),"Eilat (PTI) - Harnaaz Sandhu from Punjab won the Miss Universe 2021 title, becoming only the third Indian woman to be crowned Miss Universe after Sushmita Sen in 1994 and Lara Dutta in 2000. Sandhu, a model and actress, represented India at the 70th Miss Universe pageant held in Eilat, Israel. She defeated contestants from 79 other countries. Her answer on combating peer pressure and social media was particularly appreciated.",Social,"June 13, 2018"
India launches PM SVANidhi scheme to support street vendors post-COVID (Report 387),"New Delhi (PTI) - The government launched the PM Street Vendor's AtmaNirbhar Nidhi scheme to provide affordable working capital loans to street vendors whose livelihoods were adversely affected by the COVID-19 lockdowns. Under the scheme, vendors can avail loans of up to Rs 10,000 initially with the option to graduate to higher credit limits upon timely repayment. A digital platform was created for vendor registration and loan disbursement.",Social,"July 18, 2015"
India scores hat-trick of Oscars with wins at Academy Awards (Report 388),Los Angeles (PTI) - India achieved a historic moment at the Academy Awards when multiple Indian productions and professionals received Oscars in the same year. The documentary Elephant Whisperers won in the documentary short category while Naatu Naatu from the Telugu film RRR won in the original song category. MM Keeravani composed and Chandrabose wrote the lyrics. It was one of India's most successful nights at the Oscars.,Social,"April 25, 2022"
Narendra Modi sworn in as Prime Minister for third consecutive term (Report 389),"New Delhi (PTI) - Narendra Modi was sworn in as Prime Minister of India for the third consecutive time on June 9, 2024, at Rashtrapati Bhavan. President Droupadi Murmu administered the oath of office to Modi, who led the National Democratic Alliance to victory in the 2024 general elections. The NDA secured 293 seats in the 543-member Lok Sabha. Several Cabinet ministers were also sworn in during the ceremony. The swearing-in was attended by leaders from neighbouring countries including Bangladesh, Sri Lanka, Nepal, and the Maldives as part of India's neighbourhood-first foreign policy.",Politics,"June 25, 2014"
Parliament passes Women's Reservation Bill guaranteeing 33 percent seats (Report 390),"New Delhi (PTI) - The Indian Parliament passed the Constitution (One Hundred and Twenty-Eighth Amendment) Bill, 2023, commonly known as the Women's Reservation Bill, which reserves 33 percent of seats in the Lok Sabha and state legislative assemblies for women. The Rajya Sabha passed the bill with 214 votes in favour and no opposition. Prime Minister Narendra Modi called it a historic moment for Indian democracy. The law will come into effect after the next delimitation exercise.",Politics,"January 03, 2024"
Congress wins Karnataka assembly elections securing 135 seats (Report 391),"Bengaluru (PTI) - The Indian National Congress won a decisive majority in the Karnataka assembly elections, securing 135 seats in the 224-member assembly, according to the Election Commission of India. The Bharatiya Janata Party was reduced to 66 seats while the Janata Dal (Secular) won 19 seats. Congress leader Siddaramaiah was later sworn in as Chief Minister. The results marked a significant setback for the BJP which had governed the state.",Politics,"January 27, 2020"
Arvind Kejriwal arrested by Enforcement Directorate in Delhi liquor policy case (Report 392),New Delhi (PTI) - Delhi Chief Minister Arvind Kejriwal was arrested by the Enforcement Directorate on Thursday in connection with the alleged Delhi excise policy scam. This made Kejriwal the first sitting Chief Minister to be arrested in India. The ED alleged that proceeds of crime were used to fund election campaigns. The Aam Aadmi Party called the arrest politically motivated. The Delhi High Court later examined his custody conditions.,Politics,"March 02, 2019"
BJP wins Uttar Pradesh assembly elections with massive majority (Report 393),"Lucknow (PTI) - The Bharatiya Janata Party won a massive majority in the Uttar Pradesh assembly elections, securing 255 seats out of 403. The Samajwadi Party won 111 seats. Yogi Adityanath was sworn in as Chief Minister for the second term. The election result was seen as a significant endorsement of the BJP's governance in the state and a strong indicator ahead of the 2024 general elections.",Politics,"May 07, 2016"
"India elects Droupadi Murmu as 15th President, first tribal woman to hold office (Report 394)","New Delhi (PTI) - Droupadi Murmu was elected as the 15th President of India, becoming the first tribal woman and the second woman to hold the country's highest constitutional office. She defeated opposition candidate Yashwant Sinha by securing 64 percent of the total valid votes. Born in a tribal family in Odisha's Mayurbhanj district, Murmu was the former Governor of Jharkhand. She was sworn in on July 25, 2022.",Politics,"May 10, 2023"
Rahul Gandhi disqualified from Lok Sabha after conviction in defamation case (Report 395),"New Delhi (PTI) - Congress leader Rahul Gandhi was disqualified from the Lok Sabha after a Surat court convicted him in a 2019 criminal defamation case over his Modi surname remarks. The disqualification came into effect immediately after the conviction. Gandhi later appealed against the conviction in the Supreme Court, which stayed the conviction and restored his membership. The episode triggered a political controversy across the country.",Politics,"June 14, 2019"
Election Commission announces 2024 Lok Sabha election schedule across seven phases (Report 396),"New Delhi (PTI) - The Election Commission of India announced the schedule for the 18th General Elections to be held in seven phases between April 19 and June 1, 2024. The counting of votes was scheduled for June 4, 2024. The announcement set in motion the Model Code of Conduct across the country. Over 960 million voters were eligible to participate in the elections, making it the world's largest democratic exercise.",Politics,"February 11, 2016"
AAP sweeps Delhi assembly elections winning 62 of 70 seats (Report 397),"New Delhi (PTI) - The Aam Aadmi Party led by Arvind Kejriwal swept the Delhi assembly elections, winning 62 of the 70 seats. The BJP won eight seats while the Congress drew a blank for the second consecutive time. Kejriwal was sworn in as Chief Minister for the third time. The result was seen as a strong mandate for AAP's governance model focused on free electricity, water, and improvements in government schools and hospitals.",Politics,"December 16, 2021"
"TMC wins West Bengal assembly elections, Mamata Banerjee retains power (Report 398)","Kolkata (PTI) - The Trinamool Congress won the West Bengal assembly elections for the third consecutive time, securing 213 seats in the 294-seat assembly. The BJP, which had mounted an aggressive campaign, won 77 seats. Mamata Banerjee was sworn in as Chief Minister for the third term. The election was marked by violence in several districts and high voter turnout. The Supreme Court took note of post-poll violence in the state.",Politics,"June 14, 2019"
Modi government launches PM Kisan Samman Nidhi scheme for farmers (Report 399),"New Delhi (PTI) - Prime Minister Narendra Modi launched the Pradhan Mantri Kisan Samman Nidhi scheme, under which eligible farmer families would receive Rs 6,000 per year in direct income support, paid in three equal instalments. The scheme was announced in the interim budget and was made applicable to all farmer families across the country. The government said the scheme would benefit approximately 120 million farming families across India.",Politics,"October 11, 2024"
India and China agree to disengage troops from all friction points in eastern Ladakh (Report 400),"New Delhi (PTI) - India and China reached an agreement on patrolling arrangements along the Line of Actual Control in eastern Ladakh, effectively ending the over four-year military standoff that began in May 2020. The Indian Army confirmed that disengagement had been completed at the Depsang and Demchok friction points. The agreement was announced by the Ministry of External Affairs. The two countries agreed to resume normal patrolling activities.",Politics,"August 05, 2018"
Amit Shah introduces Citizenship Amendment Act in Parliament (Report 401),"New Delhi (PTI) - Home Minister Amit Shah introduced the Citizenship Amendment Bill in the Lok Sabha, which proposed to grant Indian citizenship to persecuted minorities from Pakistan, Bangladesh and Afghanistan. The bill was passed by the Lok Sabha with 311 votes in favour and 80 against. The bill excluded Muslims from its ambit, triggering widespread protests across the country particularly in the Northeast and universities.",Politics,"May 16, 2017"
Supreme Court upholds abrogation of Article 370 in Jammu and Kashmir (Report 402),"New Delhi (PTI) - The Supreme Court of India unanimously upheld the constitutional validity of the abrogation of Article 370, which had granted special status to Jammu and Kashmir. A five-judge constitution bench led by Chief Justice D Y Chandrachud also directed the Election Commission to hold assembly elections in J&K by September 30, 2024. The court said the President had the power to abrogate Article 370.",Politics,"August 10, 2015"
India's Opposition forms INDIA alliance ahead of 2024 general elections (Report 403),"Mumbai (PTI) - Twenty-six opposition parties came together to form the Indian National Developmental Inclusive Alliance, abbreviated as INDIA, to contest the 2024 general elections jointly against the ruling BJP-led NDA. The alliance was announced after a meeting in Mumbai. The member parties included the Indian National Congress, Trinamool Congress, DMK, Aam Aadmi Party, Samajwadi Party, NCP, Shiv Sena and others.",Politics,"April 18, 2019"
Pulwama terror attack kills 40 CRPF jawans in Jammu and Kashmir (Report 404),"Pulwama (PTI) - A suicide bomber rammed an explosive-laden vehicle into a CRPF convoy on the Jammu-Srinagar National Highway at Pulwama in Jammu and Kashmir, killing at least 40 paramilitary personnel and injuring several others. Pakistan-based terrorist organisation Jaish-e-Mohammed claimed responsibility for the attack. The attack triggered massive outrage across the country and led to severe strain in India-Pakistan relations. The government vowed strong action against the perpetrators.",Security,"March 07, 2024"
Indian Air Force conducts airstrikes on Balakot terror camp in Pakistan (Report 405),"New Delhi (PTI) - The Indian Air Force conducted airstrikes on a Jaish-e-Mohammed terrorist training camp in Balakot in Pakistan's Khyber Pakhtunkhwa province, in retaliation for the Pulwama terror attack. The strikes were carried out in the early hours and were described as a non-military preemptive action. Foreign Secretary Vijay Gokhale briefed ambassadors in New Delhi about the strikes. Pakistan denied any damage to the camp.",Security,"April 15, 2024"
"Uri army base attack kills 18 soldiers, India launches surgical strikes (Report 406)","Uri (PTI) - Militants attacked an Indian Army brigade headquarters at Uri in Jammu and Kashmir's Baramulla district, killing 18 soldiers and injuring 19 others in one of the deadliest attacks on the armed forces in recent years. The militants stormed the base and set fire to tents before being neutralised. Following the attack, Indian Army special forces conducted surgical strikes across the Line of Control against launch pads used by militants.",Security,"March 21, 2014"
