title,text,subject,date
India reports over four lakh COVID cases in a single day at second wave peak (Report 134),"New Delhi (PTI) - India reported a record 4,14,188 new COVID-19 cases in a single day as the second wave of the pandemic swept across the country, overwhelming the healthcare system. Hospitals in major cities including Delhi and Mumbai faced acute shortages of oxygen, ICU beds, and critical medicines. The death toll also reached a record high with 3,915 deaths reported in a single day. Multiple states imposed lockdowns and curfews to control the spread.",Health,"August 18, 2015"
India launches world's largest COVID-19 vaccination drive (Report 135),"New Delhi (PTI) - India launched the world's largest COVID-19 vaccination drive, beginning with the inoculation of healthcare workers across the country. Prime Minister Narendra Modi addressed the nation and declared the drive a success in the making. Two vaccines — Covishield developed by the Serum Institute of India and Covaxin developed by Bharat Biotech — were approved for emergency use. India aimed to vaccinate 300 million people by July 2021.",Health,"January 11, 2020"
India imposes nationwide lockdown to contain COVID-19 spread (Report 136),"New Delhi (PTI) - Prime Minister Narendra Modi announced a complete nationwide lockdown for 21 days to contain the spread of COVID-19, giving citizens only four hours notice before the restrictions came into effect. The lockdown required all citizens to stay home except for essential services. It was one of the most stringent lockdowns in the world. The announcement triggered a mass exodus of migrant workers from cities to their home states.",Health,"May 17, 2018"
India achieves milestone of 2 billion COVID-19 vaccine doses administered (Report 137),"New Delhi (PTI) - India achieved the milestone of administering 2 billion COVID-19 vaccine doses since the launch of its vaccination programme, making it the first country after China to cross this mark. The Union Health Ministry said this achievement was a testament to India's robust vaccination delivery infrastructure. Prime Minister Modi congratulated health workers and scientists. India had vaccinated the majority of its eligible adult population.",Health,"January 16, 2021"
Omicron variant drives third wave of COVID across India (Report 138),"New Delhi (PTI) - India's third wave of COVID-19 driven by the Omicron variant saw daily case counts rise sharply across the country with major cities including Mumbai, Delhi, and Kolkata reporting the highest numbers. However, hospitalisation rates remained significantly lower than in the second wave. The government reimposed several restrictions including night curfews in multiple states. Health officials urged eligible citizens to receive booster doses.",Health,"January 05, 2022"
"Chandrayaan-3 successfully lands near moon's south pole, India makes history (Report 139)","Bengaluru (ISRO) - India's Chandrayaan-3 spacecraft successfully landed near the south pole of the Moon, making India the fourth country in the world and the first to land near the lunar south pole. The Vikram lander touched down and subsequently deployed the Pragyan rover, which began exploring the lunar surface. Prime Minister Modi, who was attending the BRICS summit in South Africa, joined the celebration virtually. ISRO scientists erupted in joy at the Mission Operations Complex.",Science,"November 16, 2021"
ISRO successfully launches Aditya-L1 solar mission (Report 140),"Sriharikota (ISRO) - The Indian Space Research Organisation successfully launched the Aditya-L1 spacecraft, India's first space-based solar observatory, aboard the PSLV-C57 rocket from the Satish Dhawan Space Centre in Sriharikota. The spacecraft is destined for the Sun-Earth Lagrangian point 1, located approximately 1.5 million kilometres from Earth, from where it will study the Sun's outer atmosphere, solar winds, and solar flares.",Science,"July 06, 2015"
Chandrayaan-2 orbiter continues to function successfully around moon (Report 141),"Bengaluru (ISRO) - India's Chandrayaan-2 orbiter continues to function successfully in lunar orbit nearly five years after it was launched, according to ISRO. While the Vikram lander crashed during its soft landing attempt in September 2019, the orbiter has been sending valuable data from its eight scientific instruments. ISRO said the orbiter has a mission life of several more years and has contributed significant data on the lunar surface and exosphere.",Science,"September 28, 2025"
India successfully tests Agni-5 missile with multiple independently targetable warheads (Report 142),"New Delhi (PTI) - India successfully conducted a flight test of the Agni-5 ballistic missile equipped with Multiple Independently Targetable Re-entry Vehicle technology, becoming one of the few countries to possess this capability. MIRV technology allows a single missile to carry multiple warheads that can hit different targets. The test was conducted from APJ Abdul Kalam Island off the Odisha coast. Defence Minister Rajnath Singh congratulated DRDO and the armed forces.",Science,"March 22, 2015"
IIT researchers develop low-cost COVID testing kit with 96 percent accuracy (Report 143),"New Delhi (PTI) - Researchers at the Indian Institute of Technology, Delhi developed a low-cost rapid diagnostic kit for detecting COVID-19 with an accuracy of 96 percent. The kit, which could deliver results within one hour at a fraction of the cost of standard RT-PCR tests, was submitted for regulatory approval to the Indian Council of Medical Research. The development was funded by the Department of Science and Technology and offered hope for mass testing in rural areas.",Science,"June 08, 2017"
ISRO's PSLV-C55 successfully places TeLEOS-2 and Lumelite-4 in orbit (Report 144),Sriharikota (ISRO) - India's Polar Satellite Launch Vehicle PSLV-C55 successfully placed Singapore's TeLEOS-2 and Lumelite-4 satellites into their designated orbits from the Satish Dhawan Space Centre. The mission demonstrated India's growing capabilities as a commercial satellite launch provider. ISRO Chairman S Somanath said the successful launch further established India's position as a reliable partner for international space missions.,Science,"February 23, 2016"
India launches NavIC navigation satellite to enhance regional positioning system (Report 145),"Sriharikota (ISRO) - India successfully launched the NVS-01 navigation satellite, the first of the second generation of the Navigation with Indian Constellation system, using the GSLV-F12 rocket. The NVS-01 carries an L1 signal payload for the first time, making NavIC signals compatible with civilian receivers worldwide. NavIC provides positioning, navigation, and timing services over India and the surrounding region.",Science,"April 01, 2014"
Cyclone Amphan devastates West Bengal and Odisha killing over 80 (Report 146),"Kolkata (PTI) - Super Cyclone Amphan, the most powerful storm to form in the Bay of Bengal in two decades, made landfall between Digha and Hatibania near the Sunderban delta causing widespread devastation across West Bengal and Odisha. Over 80 people were killed and millions were rendered homeless. The storm caused damage estimated at over Rs 1 lakh crore. The Army and NDRF were deployed for rescue and relief operations.",Disaster,"February 09, 2022"
Uttarakhand floods claim over 200 lives in worst monsoon disaster in years (Report 147),"Dehradun (PTI) - Flash floods and landslides triggered by extremely heavy monsoon rainfall killed more than 200 people across Uttarakhand in one of the worst natural disasters to hit the hill state in years. Several villages were swept away and hundreds of people remained missing. The Army, NDRF, and SDRF launched massive rescue operations. The disaster caused widespread damage to roads, bridges, and infrastructure in the mountain state.",Disaster,"February 06, 2015"
"Cyclone Tauktae hits Gujarat coast, kills over 150 across western India (Report 148)","Ahmedabad (PTI) - Extremely severe cyclonic storm Tauktae made landfall near Una in Gujarat's Gir Somnath district with wind speeds of up to 175 kilometres per hour, killing over 150 people across Goa, Maharashtra, Karnataka, and Gujarat. A naval vessel with hundreds of COVID patients aboard sank off the Mumbai coast during the storm. Thousands were evacuated ahead of the landfall in the largest pre-cyclone evacuation in years.",Disaster,"April 18, 2015"
"Chamoli glacier burst triggers massive floods in Uttarakhand, kills over 70 (Report 149)",Dehradun (PTI) - A massive flood swept through the Rishiganga and Dhauliganga river valleys in Uttarakhand's Chamoli district after a glacier burst triggered a wall of water and debris. The flood destroyed a dam under construction on the Rishiganga river and severely damaged the Tapovan-Vishnugad hydroelectric project. More than 70 people were killed and over 100 remained missing. The disaster raised questions about construction in ecologically fragile mountain zones.,Disaster,"January 01, 2022"
"Cyclone Biparjoy makes landfall in Kutch, thousands evacuated (Report 150)","Ahmedabad (PTI) - Extremely severe cyclonic storm Biparjoy made landfall near Jakhau port in Kutch district of Gujarat after more than 100,000 people were evacuated from coastal areas of Gujarat and Rajasthan. The storm caused significant damage to infrastructure and disrupted power supply in several districts. No major loss of life was reported due to the pre-emptive evacuations. The NDRF deployed 34 teams for relief and rescue operations.",Disaster,"May 02, 2023"
"India wins T20 World Cup 2024, defeating South Africa in final (Report 151)",Bridgetown (PTI) - India won the ICC Men's T20 World Cup 2024 for the second time by defeating South Africa by seven runs in the final at Kensington Oval in Barbados. Virat Kohli scored a crucial 76 runs and was named Player of the Match. India remained unbeaten throughout the tournament. The victory came after an eleven-year wait for an ICC title. Captain Rohit Sharma and coach Rahul Dravid were given a heroes' welcome on their return to India.,Sports,"January 12, 2017"
Neeraj Chopra wins gold medal in javelin throw at Tokyo Olympics (Report 152),Tokyo (PTI) - Neeraj Chopra became only the second Indian athlete to win an individual gold medal at the Olympic Games when he threw the javelin a distance of 87.58 metres at the Tokyo Summer Olympics. The 23-year-old from Haryana produced his best throw in the first attempt and held on to clinch India's first ever gold medal in athletics at the Olympics. The victory was celebrated across India. He was subsequently awarded the Major Dhyan Chand Khel Ratna award.,Sports,"June 05, 2018"
India beat Pakistan in World Cup 2023 match by seven wickets (Report 153),"Ahmedabad (PTI) - India defeated Pakistan by seven wickets in the ICC Cricket World Cup 2023 group stage match at the Narendra Modi Stadium in Ahmedabad. Jasprit Bumrah and Kuldeep Yadav wreaked havoc with the ball as Pakistan were bowled out for 191. India chased the target with more than 10 overs to spare. Rohit Sharma scored 86 runs. The match was watched by a record crowd of over 100,000 at the stadium.",Sports,"June 23, 2016"
PV Sindhu becomes first Indian to win two Olympic medals winning silver (Report 154),"Tokyo (PTI) - PV Sindhu became the first Indian to win two Olympic medals when she won a bronze medal at the Tokyo Summer Olympics, adding to the silver she had won at the Rio Olympics in 2016. Sindhu defeated China's He Bingjiao in the bronze medal match of the women's singles badminton event. She had been defeated in the semifinal by the eventual gold medallist. The achievement cemented her status as India's greatest shuttler.",Sports,"August 02, 2019"
India hosts G20 Summit successfully under its presidency (Report 155),"New Delhi (PTI) - India successfully hosted the G20 Leaders' Summit at Bharat Mandapam in New Delhi under its presidency. The summit adopted the New Delhi Declaration by consensus, with all 20 member countries endorsing the document. Prime Minister Modi announced the addition of the African Union as a permanent member of the G20. The summit was attended by leaders including US President Joe Biden, UK Prime Minister Rishi Sunak, and French President Emmanuel Macron.",Politics,"August 12, 2017"
Virat Kohli announces retirement from Test cricket (Report 156),"New Delhi (PTI) - Star Indian cricketer Virat Kohli announced his retirement from Test cricket in a post on social media. Kohli, who is widely regarded as one of the greatest batsmen in the history of the game, scored 9,230 runs in 123 Test matches including 30 centuries. He captained the Indian team to several memorable Test victories including a historic series win in Australia. His retirement marked the end of an era in Indian cricket.",Sports,"December 05, 2018"
Mirabai Chanu wins silver medal in weightlifting at Tokyo Olympics (Report 157),"Tokyo (PTI) - Saikhom Mirabai Chanu won a silver medal in the 49 kg category in weightlifting at the Tokyo Summer Olympics, giving India its first medal of the Games. Chanu lifted a total weight of 202 kg in the clean and jerk and snatch disciplines. The 26-year-old from Manipur had won gold at the 2017 World Weightlifting Championships. Her medal was India's first in Olympic weightlifting since Karnam Malleswari won bronze at the Sydney Olympics in 2000.",Sports,"January 02, 2023"
Supreme Court upholds right to privacy as fundamental right (Report 158),New Delhi (PTI) - A nine-judge constitution bench of the Supreme Court of India unanimously held that the right to privacy is a fundamental right protected under the Indian Constitution. The landmark judgment was delivered in the context of challenges to the Aadhaar biometric identity scheme. Chief Justice J S Khehar and eight other judges wrote separate concurring opinions. The ruling has far-reaching implications for data protection law in India.,Judiciary,"July 05, 2018"
"Supreme Court decriminalises Section 377, legalises same-sex relationships (Report 159)","New Delhi (PTI) - A five-judge constitution bench of the Supreme Court unanimously struck down the part of Section 377 of the Indian Penal Code that criminalised consensual homosexual acts between adults. Chief Justice Dipak Misra, writing the lead judgment, said the colonial-era law was a violation of fundamental rights including the right to equality, dignity, and privacy. The verdict was hailed as historic by LGBTQ activists across the country.",Judiciary,"April 24, 2021"
Supreme Court verdict paves way for Ram temple construction in Ayodhya (Report 160),"New Delhi (PTI) - The Supreme Court in a unanimous verdict by a five-judge constitution bench directed that the disputed 2.77-acre site at Ayodhya be handed over to a trust to build a Ram temple. The court also directed the government to allot an alternative five-acre plot to the Sunni Waqf Board for a mosque. The 1,045-page judgment declared that the demolition of the Babri Masjid in 1992 was illegal and a violation of law.",Judiciary,"January 27, 2016"
"Ram Mandir consecration ceremony held in Ayodhya, PM Modi performs pran pratishtha (Report 161)","Ayodhya (PTI) - Prime Minister Narendra Modi performed the pran pratishtha or consecration ceremony of Ram Lalla at the newly constructed Ram temple in Ayodhya in the presence of thousands of saints, dignitaries, and prominent citizens from across India. The ceremony marked the culmination of a decades-long movement for the construction of a temple at the birthplace of Lord Ram. The event was televised nationally and celebrated across the country.",Social,"March 28, 2025"
Nirbhaya case convicts hanged after seven years of legal battle (Report 162),"New Delhi (PTI) - The four convicts in the December 2012 Delhi gang rape case, commonly known as the Nirbhaya case, were hanged at Tihar Jail at 5:30 am after a prolonged legal battle spanning more than seven years. The convicts — Mukesh Singh, Pawan Gupta, Vinay Sharma, and Akshay Kumar Singh — were convicted of gang-raping a 23-year-old paramedic student on a bus and throwing her off. The hanging came after all legal remedies were exhausted.",Judiciary,"December 08, 2025"
India passes Personal Data Protection Bill in Parliament (Report 163),"New Delhi (PTI) - The Indian Parliament passed the Digital Personal Data Protection Act, providing a legal framework for the collection, processing, and storage of digital personal data of Indian citizens. The law establishes a Data Protection Board and introduces the concept of data principals and data fiduciaries. It was widely seen as India's equivalent of the European Union's General Data Protection Regulation. Civil society groups raised concerns about exemptions granted to the government.",Judiciary,"December 24, 2021"
Farmers protest ends after government agrees to repeal three farm laws (Report 164),"New Delhi (PTI) - Prime Minister Narendra Modi announced the repeal of the three controversial farm laws that had triggered a year-long protest by farmers mainly from Punjab, Haryana, and western Uttar Pradesh at the borders of Delhi. Modi said the government had failed to convince a section of farmers about the benefits of the laws and hence decided to repeal them. Parliament subsequently passed the Farm Laws Repeal Bill. The farmers' unions called off their protests.",Social,"October 15, 2024"
India passes Waqf Amendment Bill amid protests from Muslim groups (Report 165),New Delhi (PTI) - The Indian Parliament passed the Waqf (Amendment) Bill despite protests from Muslim groups and opposition parties who said the bill interfered with the administration of Islamic charitable endowments. The government said the bill was aimed at bringing transparency and accountability to the Waqf Boards. Critics argued that the bill gave excessive powers to government-appointed members in Waqf Boards. The bill was referred to a joint parliamentary committee before being passed.,Social,"November 11, 2016"
Reliance Industries becomes first Indian company to cross Rs 20 lakh crore market cap (Report 166),"Mumbai (PTI) - Reliance Industries Limited became the first Indian company to cross the market capitalisation of Rs 20 lakh crore on the stock exchanges, cementing its position as India's most valuable company by a wide margin. The conglomerate led by Mukesh Ambani has interests spanning petrochemicals, refining, retail, telecom, and digital services. Reliance's Jio Platforms had already attracted massive investments from global technology and private equity funds.",Business,"April 10, 2023"
Tata Motors completes acquisition of Jaguar Land Rover from Ford (Report 167),"Mumbai (PTI) - Tata Motors completed the acquisition of Jaguar Land Rover from Ford Motor Company for 2.3 billion dollars in one of the largest overseas acquisitions by an Indian company at the time. The deal gave Tata Motors ownership of two of Britain's most prestigious automobile brands. The acquisition was initially seen as risky but JLR later became a major profit driver for Tata Motors, contributing significantly to the group's global revenues.",Business,"August 11, 2020"
UPI transactions cross Rs 20 lakh crore in December 2023 (Report 168),"New Delhi (PTI) - Unified Payments Interface transactions crossed the milestone of Rs 20 lakh crore in value during December 2023, according to data released by the National Payments Corporation of India. A total of 12.02 billion UPI transactions were recorded during the month, with a value of Rs 18.23 lakh crore. The Finance Ministry said the achievement reflected the success of India's digital payment infrastructure which has become a model for the world.",Business,"May 04, 2017"
Byju's faces insolvency proceedings as creditors move NCLT (Report 169),"New Delhi (PTI) - The National Company Law Tribunal admitted an insolvency petition against education technology company Byju's filed by the Board of Control for Cricket in India over non-payment of dues. The development marked a dramatic fall from grace for what was once India's most valuable startup. Byju's had faced a series of controversies including delayed financial results, allegations of financial mismanagement, and disputes with lenders over loan covenants.",Business,"October 14, 2015"
India bans 59 Chinese apps including TikTok citing security concerns (Report 170),"New Delhi (PTI) - The Indian government banned 59 mobile applications developed by Chinese companies, including the popular short video platform TikTok, citing concerns about national security and the privacy of Indian users. The Ministry of Electronics and Information Technology said the apps were engaged in activities that were prejudicial to India's sovereignty, integrity, defence, and public order. The ban came amid heightened tensions along the China-India border in Ladakh.",Business,"October 12, 2025"
India pledges net zero emissions by 2070 at COP26 climate summit (Report 171),"Glasgow (PTI) - Prime Minister Narendra Modi announced at the COP26 climate summit in Glasgow that India would achieve net zero carbon emissions by 2070. He also announced that India would meet 50 percent of its energy requirements from renewable sources by 2030, increase non-fossil fuel energy capacity to 500 gigawatts by 2030, and reduce the total projected carbon emissions by one billion tonnes by the same year. The pledges were seen as significant from a major developing economy.",Environment,"December 26, 2023"
Delhi records worst air quality in three years as AQI crosses 450 (Report 172),"New Delhi (PTI) - Delhi's air quality deteriorated to its worst level in three years with the Air Quality Index crossing 450, placing it firmly in the severe plus or emergency category. Crop burning in neighbouring Punjab and Haryana combined with unfavourable meteorological conditions and vehicular and industrial emissions were blamed for the toxic smog. Schools were shut and construction activities banned. The Supreme Court summoned officials to address the annual crisis.",Environment,"January 17, 2014"
India's renewable energy capacity crosses 200 gigawatt milestone (Report 173),"New Delhi (PTI) - India's total installed renewable energy capacity crossed the 200 gigawatt milestone, according to the Ministry of New and Renewable Energy, making it the fourth largest renewable energy country in the world. Solar energy accounted for the largest share of the renewable capacity, followed by wind, hydro, and bioenergy. India has set a target of achieving 500 gigawatts of non-fossil fuel-based energy capacity by 2030.",Environment,"December 02, 2015"
Serum Institute of India emerges as world's largest vaccine manufacturer (Report 174),"Pune (PTI) - The Serum Institute of India based in Pune emerged as the world's largest vaccine manufacturer by volume, producing more than 1.5 billion doses of various vaccines annually. The institute, led by Adar Poonawalla, played a critical role in the global response to the COVID-19 pandemic by producing the Covishield vaccine under license from AstraZeneca and Oxford University. India supplied vaccines to over 100 countries through the COVAX programme.",Health,"May 05, 2018"
"India eradicates wild poliovirus, WHO certifies country polio-free (Report 175)","New Delhi (WHO) - The World Health Organisation certified India as free of wild poliovirus, a major public health milestone for a country that once accounted for the majority of global polio cases. The last case of wild poliovirus in India was recorded in January 2011. The achievement was attributed to the success of the Pulse Polio immunisation campaign which vaccinated hundreds of millions of children. India was declared polio-free by the WHO in 2014.",Health,"May 14, 2015"
AIIMS doctors perform rare heart transplant surgery on infant (Report 176),"New Delhi (PTI) - Doctors at the All India Institute of Medical Sciences in New Delhi successfully performed a rare heart transplant surgery on a six-month-old infant, one of the youngest recipients of a heart transplant in the country. The surgery lasted over eight hours and involved a team of 20 doctors and nurses. The infant, who suffered from a congenital heart defect, recovered well after the procedure. The team was led by a senior cardiac surgeon.",Health,"November 06, 2015"
India inaugurates first Vande Bharat Express semi-high-speed train (Report 177),"New Delhi (PTI) - Prime Minister Narendra Modi flagged off the first Vande Bharat Express, India's first semi-high-speed self-propelled passenger train, from the New Delhi railway station. The train, manufactured at the Integral Coach Factory in Chennai, can achieve speeds of up to 160 kilometres per hour. It operates on the New Delhi to Varanasi route. The Train 18, as it was originally called, was developed under the Make in India initiative at a fraction of the cost of imported trains.",Infrastructure,"August 23, 2016"
Mumbai-Ahmedabad bullet train project work begins (Report 178),"Ahmedabad (PTI) - Prime Minister Narendra Modi and Japanese Prime Minister Shinzo Abe jointly laid the foundation stone for the Mumbai-Ahmedabad high-speed rail corridor, India's first bullet train project. The project is being built with Japanese technical expertise and a soft loan from the Japan International Cooperation Agency. The 508-kilometre corridor will allow travel at speeds of up to 320 kilometres per hour, reducing the journey time from eight hours to around three hours.",Infrastructure,"October 08, 2017"
