title,text,subject,date
"Cyclone Biparjoy makes landfall in Kutch, thousands evacuated (Report 635)","Ahmedabad (PTI) - Extremely severe cyclonic storm Biparjoy made landfall near Jakhau port in Kutch district of Gujarat after more than 100,000 people were evacuated from coastal areas of Gujarat and Rajasthan. The storm caused significant damage to infrastructure and disrupted power supply in several districts. No major loss of life was reported due to the pre-emptive evacuations. The NDRF deployed 34 teams for relief and rescue operations.",Disaster,"February 27, 2024"
"India wins T20 World Cup 2024, defeating South Africa in final (Report 636)",Bridgetown (PTI) - India won the ICC Men's T20 World Cup 2024 for the second time by defeating South Africa by seven runs in the final at Kensington Oval in Barbados. Virat Kohli scored a crucial 76 runs and was named Player of the Match. India remained unbeaten throughout the tournament. The victory came after an eleven-year wait for an ICC title. Captain Rohit Sharma and coach Rahul Dravid were given a heroes' welcome on their return to India.,Sports,"November 24, 2025"
Neeraj Chopra wins gold medal in javelin throw at Tokyo Olympics (Report 637),Tokyo (PTI) - Neeraj Chopra became only the second Indian athlete to win an individual gold medal at the Olympic Games when he threw the javelin a distance of 87.58 metres at the Tokyo Summer Olympics. The 23-year-old from Haryana produced his best throw in the first attempt and held on to clinch India's first ever gold medal in athletics at the Olympics. The victory was celebrated across India. He was subsequently awarded the Major Dhyan Chand Khel Ratna award.,Sports,"August 04, 2025"
India beat Pakistan in World Cup 2023 match by seven wickets (Report 638),"Ahmedabad (PTI) - India defeated Pakistan by seven wickets in the ICC Cricket World Cup 2023 group stage match at the Narendra Modi Stadium in Ahmedabad. Jasprit Bumrah and Kuldeep Yadav wreaked havoc with the ball as Pakistan were bowled out for 191. India chased the target with more than 10 overs to spare. Rohit Sharma scored 86 runs. The match was watched by a record crowd of over 100,000 at the stadium.",Sports,"November 05, 2014"
PV Sindhu becomes first Indian to win two Olympic medals winning silver (Report 639),"Tokyo (PTI) - PV Sindhu became the first Indian to win two Olympic medals when she won a bronze medal at the Tokyo Summer Olympics, adding to the silver she had won at the Rio Olympics in 2016. Sindhu defeated China's He Bingjiao in the bronze medal match of the women's singles badminton event. She had been defeated in the semifinal by the eventual gold medallist. The achievement cemented her status as India's greatest shuttler.",Sports,"March 12, 2025"
India hosts G20 Summit successfully under its presidency (Report 640),"New Delhi (PTI) - India successfully hosted the G20 Leaders' Summit at Bharat Mandapam in New Delhi under its presidency. The summit adopted the New Delhi Declaration by consensus, with all 20 member countries endorsing the document. Prime Minister Modi announced the addition of the African Union as a permanent member of the G20. The summit was attended by leaders including US President Joe Biden, UK Prime Minister Rishi Sunak, and French President Emmanuel Macron.",Politics,"May 17, 2022"
Virat Kohli announces retirement from Test cricket (Report 641),"New Delhi (PTI) - Star Indian cricketer Virat Kohli announced his retirement from Test cricket in a post on social media. Kohli, who is widely regarded as one of the greatest batsmen in the history of the game, scored 9,230 runs in 123 Test matches including 30 centuries. He captained the Indian team to several memorable Test victories including a historic series win in Australia. His retirement marked the end of an era in Indian cricket.",Sports,"January 10, 2015"
Mirabai Chanu wins silver medal in weightlifting at Tokyo Olympics (Report 642),"Tokyo (PTI) - Saikhom Mirabai Chanu won a silver medal in the 49 kg category in weightlifting at the Tokyo Summer Olympics, giving India its first medal of the Games. Chanu lifted a total weight of 202 kg in the clean and jerk and snatch disciplines. The 26-year-old from Manipur had won gold at the 2017 World Weightlifting Championships. Her medal was India's first in Olympic weightlifting since Karnam Malleswari won bronze at the Sydney Olympics in 2000.",Sports,"September 21, 2022"
Supreme Court upholds right to privacy as fundamental right (Report 643),New Delhi (PTI) - A nine-judge constitution bench of the Supreme Court of India unanimously held that the right to privacy is a fundamental right protected under the Indian Constitution. The landmark judgment was delivered in the context of challenges to the Aadhaar biometric identity scheme. Chief Justice J S Khehar and eight other judges wrote separate concurring opinions. The ruling has far-reaching implications for data protection law in India.,Judiciary,"December 21, 2022"
"Supreme Court decriminalises Section 377, legalises same-sex relationships (Report 644)","New Delhi (PTI) - A five-judge constitution bench of the Supreme Court unanimously struck down the part of Section 377 of the Indian Penal Code that criminalised consensual homosexual acts between adults. Chief Justice Dipak Misra, writing the lead judgment, said the colonial-era law was a violation of fundamental rights including the right to equality, dignity, and privacy. The verdict was hailed as historic by LGBTQ activists across the country.",Judiciary,"February 24, 2021"
Supreme Court verdict paves way for Ram temple construction in Ayodhya (Report 645),"New Delhi (PTI) - The Supreme Court in a unanimous verdict by a five-judge constitution bench directed that the disputed 2.77-acre site at Ayodhya be handed over to a trust to build a Ram temple. The court also directed the government to allot an alternative five-acre plot to the Sunni Waqf Board for a mosque. The 1,045-page judgment declared that the demolition of the Babri Masjid in 1992 was illegal and a violation of law.",Judiciary,"October 19, 2024"
"Ram Mandir consecration ceremony held in Ayodhya, PM Modi performs pran pratishtha (Report 646)","Ayodhya (PTI) - Prime Minister Narendra Modi performed the pran pratishtha or consecration ceremony of Ram Lalla at the newly constructed Ram temple in Ayodhya in the presence of thousands of saints, dignitaries, and prominent citizens from across India. The ceremony marked the culmination of a decades-long movement for the construction of a temple at the birthplace of Lord Ram. The event was televised nationally and celebrated across the country.",Social,"May 16, 2017"
Nirbhaya case convicts hanged after seven years of legal battle (Report 647),"New Delhi (PTI) - The four convicts in the December 2012 Delhi gang rape case, commonly known as the Nirbhaya case, were hanged at Tihar Jail at 5:30 am after a prolonged legal battle spanning more than seven years. The convicts — Mukesh Singh, Pawan Gupta, Vinay Sharma, and Akshay Kumar Singh — were convicted of gang-raping a 23-year-old paramedic student on a bus and throwing her off. The hanging came after all legal remedies were exhausted.",Judiciary,"February 28, 2025"
India passes Personal Data Protection Bill in Parliament (Report 648),"New Delhi (PTI) - The Indian Parliament passed the Digital Personal Data Protection Act, providing a legal framework for the collection, processing, and storage of digital personal data of Indian citizens. The law establishes a Data Protection Board and introduces the concept of data principals and data fiduciaries. It was widely seen as India's equivalent of the European Union's General Data Protection Regulation. Civil society groups raised concerns about exemptions granted to the government.",Judiciary,"March 01, 2022"
Farmers protest ends after government agrees to repeal three farm laws (Report 649),"New Delhi (PTI) - Prime Minister Narendra Modi announced the repeal of the three controversial farm laws that had triggered a year-long protest by farmers mainly from Punjab, Haryana, and western Uttar Pradesh at the borders of Delhi. Modi said the government had failed to convince a section of farmers about the benefits of the laws and hence decided to repeal them. Parliament subsequently passed the Farm Laws Repeal Bill. The farmers' unions called off their protests.",Social,"August 17, 2022"
India passes Waqf Amendment Bill amid protests from Muslim groups (Report 650),New Delhi (PTI) - The Indian Parliament passed the Waqf (Amendment) Bill despite protests from Muslim groups and opposition parties who said the bill interfered with the administration of Islamic charitable endowments. The government said the bill was aimed at bringing transparency and accountability to the Waqf Boards. Critics argued that the bill gave excessive powers to government-appointed members in Waqf Boards. The bill was referred to a joint parliamentary committee before being passed.,Social,"May 16, 2021"
Reliance Industries becomes first Indian company to cross Rs 20 lakh crore market cap (Report 651),"Mumbai (PTI) - Reliance Industries Limited became the first Indian company to cross the market capitalisation of Rs 20 lakh crore on the stock exchanges, cementing its position as India's most valuable company by a wide margin. The conglomerate led by Mukesh Ambani has interests spanning petrochemicals, refining, retail, telecom, and digital services. Reliance's Jio Platforms had already attracted massive investments from global technology and private equity funds.",Business,"July 04, 2017"
Tata Motors completes acquisition of Jaguar Land Rover from Ford (Report 652),"Mumbai (PTI) - Tata Motors completed the acquisition of Jaguar Land Rover from Ford Motor Company for 2.3 billion dollars in one of the largest overseas acquisitions by an Indian company at the time. The deal gave Tata Motors ownership of two of Britain's most prestigious automobile brands. The acquisition was initially seen as risky but JLR later became a major profit driver for Tata Motors, contributing significantly to the group's global revenues.",Business,"November 05, 2014"
UPI transactions cross Rs 20 lakh crore in December 2023 (Report 653),"New Delhi (PTI) - Unified Payments Interface transactions crossed the milestone of Rs 20 lakh crore in value during December 2023, according to data released by the National Payments Corporation of India. A total of 12.02 billion UPI transactions were recorded during the month, with a value of Rs 18.23 lakh crore. The Finance Ministry said the achievement reflected the success of India's digital payment infrastructure which has become a model for the world.",Business,"May 04, 2017"
Byju's faces insolvency proceedings as creditors move NCLT (Report 654),"New Delhi (PTI) - The National Company Law Tribunal admitted an insolvency petition against education technology company Byju's filed by the Board of Control for Cricket in India over non-payment of dues. The development marked a dramatic fall from grace for what was once India's most valuable startup. Byju's had faced a series of controversies including delayed financial results, allegations of financial mismanagement, and disputes with lenders over loan covenants.",Business,"December 16, 2025"
India bans 59 Chinese apps including TikTok citing security concerns (Report 655),"New Delhi (PTI) - The Indian government banned 59 mobile applications developed by Chinese companies, including the popular short video platform TikTok, citing concerns about national security and the privacy of Indian users. The Ministry of Electronics and Information Technology said the apps were engaged in activities that were prejudicial to India's sovereignty, integrity, defence, and public order. The ban came amid heightened tensions along the China-India border in Ladakh.",Business,"December 23, 2020"
India pledges net zero emissions by 2070 at COP26 climate summit (Report 656),"Glasgow (PTI) - Prime Minister Narendra Modi announced at the COP26 climate summit in Glasgow that India would achieve net zero carbon emissions by 2070. He also announced that India would meet 50 percent of its energy requirements from renewable sources by 2030, increase non-fossil fuel energy capacity to 500 gigawatts by 2030, and reduce the total projected carbon emissions by one billion tonnes by the same year. The pledges were seen as significant from a major developing economy.",Environment,"September 13, 2022"
Delhi records worst air quality in three years as AQI crosses 450 (Report 657),"New Delhi (PTI) - Delhi's air quality deteriorated to its worst level in three years with the Air Quality Index crossing 450, placing it firmly in the severe plus or emergency category. Crop burning in neighbouring Punjab and Haryana combined with unfavourable meteorological conditions and vehicular and industrial emissions were blamed for the toxic smog. Schools were shut and construction activities banned. The Supreme Court summoned officials to address the annual crisis.",Environment,"September 24, 2017"
India's renewable energy capacity crosses 200 gigawatt milestone (Report 658),"New Delhi (PTI) - India's total installed renewable energy capacity crossed the 200 gigawatt milestone, according to the Ministry of New and Renewable Energy, making it the fourth largest renewable energy country in the world. Solar energy accounted for the largest share of the renewable capacity, followed by wind, hydro, and bioenergy. India has set a target of achieving 500 gigawatts of non-fossil fuel-based energy capacity by 2030.",Environment,"May 04, 2017"
Serum Institute of India emerges as world's largest vaccine manufacturer (Report 659),"Pune (PTI) - The Serum Institute of India based in Pune emerged as the world's largest vaccine manufacturer by volume, producing more than 1.5 billion doses of various vaccines annually. The institute, led by Adar Poonawalla, played a critical role in the global response to the COVID-19 pandemic by producing the Covishield vaccine under license from AstraZeneca and Oxford University. India supplied vaccines to over 100 countries through the COVAX programme.",Health,"April 12, 2017"
"India eradicates wild poliovirus, WHO certifies country polio-free (Report 660)","New Delhi (WHO) - The World Health Organisation certified India as free of wild poliovirus, a major public health milestone for a country that once accounted for the majority of global polio cases. The last case of wild poliovirus in India was recorded in January 2011. The achievement was attributed to the success of the Pulse Polio immunisation campaign which vaccinated hundreds of millions of children. India was declared polio-free by the WHO in 2014.",Health,"January 15, 2024"
AIIMS doctors perform rare heart transplant surgery on infant (Report 661),"New Delhi (PTI) - Doctors at the All India Institute of Medical Sciences in New Delhi successfully performed a rare heart transplant surgery on a six-month-old infant, one of the youngest recipients of a heart transplant in the country. The surgery lasted over eight hours and involved a team of 20 doctors and nurses. The infant, who suffered from a congenital heart defect, recovered well after the procedure. The team was led by a senior cardiac surgeon.",Health,"May 07, 2016"
India inaugurates first Vande Bharat Express semi-high-speed train (Report 662),"New Delhi (PTI) - Prime Minister Narendra Modi flagged off the first Vande Bharat Express, India's first semi-high-speed self-propelled passenger train, from the New Delhi railway station. The train, manufactured at the Integral Coach Factory in Chennai, can achieve speeds of up to 160 kilometres per hour. It operates on the New Delhi to Varanasi route. The Train 18, as it was originally called, was developed under the Make in India initiative at a fraction of the cost of imported trains.",Infrastructure,"December 02, 2023"
Mumbai-Ahmedabad bullet train project work begins (Report 663),"Ahmedabad (PTI) - Prime Minister Narendra Modi and Japanese Prime Minister Shinzo Abe jointly laid the foundation stone for the Mumbai-Ahmedabad high-speed rail corridor, India's first bullet train project. The project is being built with Japanese technical expertise and a soft loan from the Japan International Cooperation Agency. The 508-kilometre corridor will allow travel at speeds of up to 320 kilometres per hour, reducing the journey time from eight hours to around three hours.",Infrastructure,"August 22, 2023"
"Delhi Metro Phase IV receives government approval worth Rs 24,948 crore (Report 664)","New Delhi (PTI) - The Union Cabinet approved the Phase IV expansion of the Delhi Metro Rail Corporation network at an estimated cost of Rs 24,948 crore. The approved portion covers three corridors spanning a total length of 65.1 kilometres and 45 stations. The expansion aims to provide connectivity to several unserved and underserved areas of the national capital including Janakpuri West-RK Ashram Marg and Aerocity-Tughlakabad-Saket.",Infrastructure,"September 21, 2014"
"India opens Atal Tunnel, world's longest highway tunnel above 10000 feet (Report 665)","Manali (PTI) - Prime Minister Narendra Modi inaugurated the Atal Tunnel, the world's longest highway tunnel above 10,000 feet altitude, connecting the Manali valley to the Lahaul-Spiti valley in Himachal Pradesh. The 9.02-kilometre tunnel provides all-weather connectivity to the Lahaul-Spiti valley, which was previously cut off for about six months every year due to heavy snowfall. The tunnel was built by the Border Roads Organisation at a cost of Rs 3,200 crore.",Infrastructure,"April 04, 2021"
India suspends Indus Waters Treaty negotiations with Pakistan after Pahalgam attack (Report 666),New Delhi (PTI) - India announced the suspension of the Indus Waters Treaty with Pakistan and the closure of the Attari-Wagah land border crossing following the terrorist attack in Pahalgam that killed 26 tourists. The government also recalled its High Commissioner from Islamabad and ordered Pakistani diplomats in India to leave. External Affairs Minister S Jaishankar briefed the ambassadors of P5 countries and other major nations about India's decision.,International,"October 06, 2023"
India conducts Operation Ganga to evacuate citizens from Ukraine (Report 667),"New Delhi (PTI) - India launched Operation Ganga to evacuate Indian nationals, primarily students, stranded in Ukraine following Russia's military invasion. Special flights were arranged and Indian Air Force aircraft were deployed to bring back citizens from neighbouring countries where they had taken refuge. Over 20,000 Indians were evacuated. Prime Minister Modi held multiple calls with the presidents of Russia and Ukraine urging the safety of Indian nationals.",International,"April 14, 2015"
India and US sign BECA defence agreement during 2+2 dialogue (Report 668),"New Delhi (PTI) - India and the United States signed the Basic Exchange and Cooperation Agreement for Geospatial Intelligence during the third India-US 2+2 Ministerial Dialogue, completing the set of four foundational defence agreements between the two countries. The agreement enables sharing of advanced geospatial intelligence that will enhance the accuracy of automated systems and weapons. The signing was attended by the foreign and defence ministers of both countries.",International,"February 11, 2020"
India wins hosting rights for 2036 Summer Olympics (Report 669),"New Delhi (PTI) - The International Olympic Committee awarded India the right to host the 2036 Summer Olympic Games, a landmark achievement for the country which would be hosting the Games for the first time. The announcement was made by IOC President Thomas Bach. Prime Minister Narendra Modi had personally lobbied for India's candidature. Ahmedabad and other Indian cities will host the events. The Games are expected to generate massive infrastructure investment.",International,"November 04, 2025"
India signs free trade agreement with UAE boosting bilateral trade (Report 670),"New Delhi (PTI) - India and the United Arab Emirates signed a Comprehensive Economic Partnership Agreement, the first such trade deal signed by India in over a decade. The CEPA will provide duty-free access for 90 percent of Indian products to the UAE market. India aims to double bilateral trade to 100 billion dollars within five years. Commerce Minister Piyush Goyal said the agreement would create over a million jobs in India.",Business,"April 09, 2022"
SEBI cracks down on front-running cases in mutual fund industry (Report 671),"Mumbai (PTI) - The Securities and Exchange Board of India took action against fund managers and dealers in multiple asset management companies for front-running, a practice where traders use advance knowledge of pending orders to profit personally. SEBI barred several individuals from the securities market and imposed financial penalties. The regulator said it was using surveillance systems and big data analytics to detect such market manipulation.",Business,"June 20, 2025"
India opens Kartarpur Corridor allowing pilgrims visa-free access to Pakistan shrine (Report 672),Kartarpur (PTI) - Prime Minister Narendra Modi inaugurated the Kartarpur Corridor allowing Indian Sikh pilgrims to visit the Gurdwara Darbar Sahib in Pakistan's Kartarpur without a visa. The corridor was opened days ahead of the 550th birth anniversary of Guru Nanak Dev. Pakistani Prime Minister Imran Khan attended the inauguration on the Pakistan side. The corridor had been a long-standing demand of the Sikh community.,International,"April 23, 2016"
RBI launches digital rupee pilot programme (Report 673),"Mumbai (PTI) - The Reserve Bank of India launched a pilot of the Central Bank Digital Currency in the wholesale segment, marking India's entry into the world of sovereign digital currency. The e-rupee is a digital token that represents legal tender. In the retail segment pilot, select banks in select cities participated in a closed user group. The RBI said the CBDC would supplement and not replace physical cash.",Business,"November 14, 2023"
India bans export of non-basmati white rice to stabilise domestic prices (Report 674),New Delhi (PTI) - The Indian government imposed a ban on exports of non-basmati white rice with immediate effect to boost domestic availability and keep prices under control. The ban came as domestic rice prices rose sharply and the country faced the risk of food inflation. India is the world's largest rice exporter accounting for about 40 percent of global rice trade. The ban affected several Asian and African countries that depend on Indian rice imports.,Economy,"June 28, 2025"
"Supreme Court stays bulldozer demolitions, issues guidelines to states (Report 675)","New Delhi (PTI) - The Supreme Court of India stayed demolition drives being conducted by state governments against properties allegedly belonging to accused persons without following due process of law, calling the practice unconstitutional. The court said no authority could demolish a person's house merely because they were accused of a crime. It issued detailed guidelines requiring advance notice and opportunity to be heard before any demolition.",Judiciary,"July 20, 2021"
India hosts SCO summit under its rotating presidency (Report 676),"New Delhi (PTI) - India hosted the Shanghai Cooperation Organisation summit under its chairmanship in virtual format, with leaders of member countries participating remotely. Prime Minister Narendra Modi chaired the meeting. The summit adopted the New Delhi Declaration. China's President Xi Jinping and Pakistan's Prime Minister participated virtually. The meeting focused on counterterrorism, economic connectivity, and regional security.",International,"December 28, 2021"
Harnaaz Sandhu wins Miss Universe 2021 crown for India (Report 677),"Eilat (PTI) - Harnaaz Sandhu from Punjab won the Miss Universe 2021 title, becoming only the third Indian woman to be crowned Miss Universe after Sushmita Sen in 1994 and Lara Dutta in 2000. Sandhu, a model and actress, represented India at the 70th Miss Universe pageant held in Eilat, Israel. She defeated contestants from 79 other countries. Her answer on combating peer pressure and social media was particularly appreciated.",Social,"August 01, 2022"
India launches PM SVANidhi scheme to support street vendors post-COVID (Report 678),"New Delhi (PTI) - The government launched the PM Street Vendor's AtmaNirbhar Nidhi scheme to provide affordable working capital loans to street vendors whose livelihoods were adversely affected by the COVID-19 lockdowns. Under the scheme, vendors can avail loans of up to Rs 10,000 initially with the option to graduate to higher credit limits upon timely repayment. A digital platform was created for vendor registration and loan disbursement.",Social,"October 11, 2024"
India scores hat-trick of Oscars with wins at Academy Awards (Report 679),Los Angeles (PTI) - India achieved a historic moment at the Academy Awards when multiple Indian productions and professionals received Oscars in the same year. The documentary Elephant Whisperers won in the documentary short category while Naatu Naatu from the Telugu film RRR won in the original song category. MM Keeravani composed and Chandrabose wrote the lyrics. It was one of India's most successful nights at the Oscars.,Social,"September 26, 2015"
